{
  "standard": "odxp/0.1",
  "package": {
    "name": "mapika/decider",
    "profile": "causal-letters",
    "path": "decider-2b",
    "conformance_sha256": "8ae5ab61f6dfc17d4b0a426c286ad39fdfff4082fc12282e4a8d1f7a394fe72e",
    "weights_sha256": "3657848acb4851da4465ab4abad7c6fe273c7e1f15e83629cd6da972a5282cb3"
  },
  "runtime": {
    "implementation": "opendxp 0.1.0",
    "profile": "causal-letters",
    "backend": "llama.cpp (llama-cpp-python 0.3.35)",
    "gpu_offload": false,
    "threads": null,
    "n_ctx": 8192,
    "decode": {
      "flash_attention": "auto",
      "kv_cache": "f16",
      "ubatch": 2048
    },
    "device": "cpu"
  },
  "machine": {
    "platform": "macOS-27.0-arm64-arm-64bit",
    "machine": "arm64",
    "processor": "Apple M4",
    "cpus": 10,
    "python": "3.12.13",
    "onnxruntime_providers": [
      "CoreMLExecutionProvider",
      "AzureExecutionProvider",
      "CPUExecutionProvider"
    ],
    "llama_cpp": "0.3.35",
    "llama_gpu_offload": true
  },
  "tolerance": {
    "max_abs_dp": 0.01,
    "tie_margin": 0.001
  },
  "cases": 52,
  "cases_passed": 52,
  "questions": 91,
  "max_abs_dp": 4.987081520341219e-05,
  "mean_abs_dp": 3.5283755860978456e-05,
  "argmax_agreement": {
    "agree": 91,
    "total": 91
  },
  "errors": {
    "expected": 0,
    "matched": 0
  },
  "latency_ms": {
    "load": 1690.1,
    "request_median": 623.8,
    "request_p90": 2838.1,
    "request_mean": 1856.37,
    "question_median": 440.22,
    "input_tokens_mean": 228.79
  },
  "package_problems": [],
  "coverage": {
    "cases": 52,
    "questions_by_type": {
      "choice": 41,
      "score": 20,
      "noul": 30
    },
    "choice_option_counts": [
      2,
      3,
      4,
      5,
      6,
      7,
      8,
      9,
      10,
      11,
      12,
      20
    ],
    "languages": [
      "ar",
      "de",
      "en",
      "es",
      "fr",
      "hi",
      "ja",
      "ne",
      "pt",
      "th",
      "zh"
    ],
    "longest_state_chars": 6687,
    "checks": {
      "cases": true,
      "question_types": true,
      "choice_2_to_10_options": true,
      "more_than_10_options": true,
      "languages": true,
      "long_state": true
    },
    "ok": true
  },
  "passed": true,
  "compatible": true,
  "failures": [],
  "checked_at": "2026-09-28T15:58:22Z"
}
